Simplified_Text,Traditional_Text,English_Text,Japanese_Text,Korean_Text
老城主的灵魂偶尔会浮现，但时间越来越短。,老城主的靈魂偶爾會浮現，但時間越來越短。,"""The old Lord's soul occasionally surfaces, but the intervals are growing longer.""",「前城主の魂が時折現れることがあるんです。でも時間はどんどん短くなっています。」,"옛 성주님의 영혼이 가끔 떠오르긴 했지만, 시간이 점점 더 짧아지고 있어요."
我记录这些，是盼着他能回来，但也渐渐明白可能无望。,我記錄這些，是盼著他能回來，但也漸漸明白可能無望。,"""I recorded this, hoping he might return, but I've gradually come to accept it may never happen.""",「私はこれを記録して、彼の帰りを願っていました。でも次第に、もう望みはないかもしれないとわかってきました。」,"제가 이걸 기록한 건, 그분이 돌아오시길 바라서였지만, 점점 희망이 없다는 걸 깨달았어요."
您问为什么现在才坦白？因为我看到您真正关心这座城市。,您問為什麼現在才坦白？因為我看到您真正關心這座城市。,"""Why am I only telling you now? Because I've seen how much you truly care about this city.""",「なぜ今になって打ち明けるのか？あなたが本当にこの街を気にかけているのを見たからです。」,"성주님, 왜 지금에서야 고백하냐고요? 전 성주님이 정말로 이 도시를 걱정해 주시는 걸 봤기 때문이에요."
你说得轻松！我被蒙在鼓里这么久，怎能不生气？,你說得輕鬆！我被蒙在鼓裡這麼久，怎能不生氣？,"""You make it sound so simple! I've been kept in the dark for so long. How can I not be angry?""",「簡単に言うな！私はこんなに長く騙されていた。怒らないわけがないだろう！」,"말이 쉽지! 내가 이렇게 오래 속아왔는데, 화가 안 날 수 있겠어?"
你站起身，目光锐利地盯住达菲。,你站起身，目光銳利地盯住達菲。,"You stood up, fixing Duffy with a sharp gaze.",あなたは立ち上がり、鋭い目でダフィーを見据えた。,"당신은 자리에서 일어나, 날카로운 시선으로 더피를 응시했다."
我知道您愤怒。但请看看笔记最后一页，老城主的留言。,我知道您憤怒。但請看看筆記最後一頁，老城主的留言。,"""I know you're furious. But please look at the last page of the notebook—the old Lord's message.""",「あなたのお怒りはわかります。でもどうかノートの最後のページを見てください。前城主のメッセージです。」,"성주님의 분노는 알아요. 하지만 메모 마지막 페이지, 옛 성주님의 메시지를 한번 봐 주세요."
“如果我无法回来，请相信达菲，她是我最信任的人。”,「如果我無法回來，請相信達菲，她是我最信任的人。」,"""'If I cannot return, please trust Duffy. She is the person I trust most.'""",「『もし私が戻れないなら、ダフィーを信じてください。彼女は私が最も信頼する者です。』」,"“만약 내가 돌아오지 못한다면, 더피를 믿어주게, 그녀는 내가 가장 믿는 사람이네.”"
老城主早预料到这一天，他希望我辅助您，而不是利用。,老城主早預料到這一天，他希望我輔助您，而不是利用。,"""The old Lord foresaw this day. He hoped I would assist you, not use you.""",「前城主はとっくにこの日を予見していたんです。彼は私があなたを利用するのではなく、補佐することを望んでいました。」,"옛 성주님은 벌써 이 날을 예견하셨고, 그분은 제가 성주님을 이용하는 게 아니라 보좌하기를 바라셨어요."
辅助？你现在还说这种话？,輔助？你現在還說這種話？,"""Assist? You still say that now?""",「補佐？今さらそんなことを？」,보좌? 너 지금도 그런 말을 해?
不，现在不同了。您已经不再是外来者，而是我们的城主。,不，現在不同了。您已經不再是外來者，而是我們的城主。,"""No, it's different now. You are no longer an outsider. You are our Lord.""",「いいえ、今は違います。あなたはもうよそ者ではなく、私たちの城主です。」,"아니요, 지금은 달라요. 성주님은 더는 외부인이 아니에요, 우리의 성주님이시죠."
您为城市付出的努力，我都看在眼里。税收改善、市民爱戴，这都是您的功劳。,您為城市付出的努力，我都看在眼裡。稅收改善、市民愛戴，這都是您的功勞。,"""I've seen all the effort you've put into the city. The improved taxes, the citizens' affection—these are your achievements.""",「あなたが街のために払った努力は、全て私の目に焼き付いています。税収の改善、市民の敬愛、これらは全てあなたの功績です。」,"성주님이 도시를 위해 기울이신 노력, 전 다 보고 있어요. 세금 개선, 시민들의 존경, 이 모두 성주님의 공이에요."
我早就不把您当替代品了，只是我傲娇，不肯承认。,我早就不把您當替代品了，只是我傲嬌，不肯承認。,"""I stopped seeing you as a substitute long ago. I was just too proud to admit it.""",「私はとっくにあなたを代用品とは思っていません。ただ、私がツンデレで、認めようとしなかっただけです。」,"전 벌써 성주님을 대체품으로 보지 않아요, 단지 제가 고집이 세서 인정하지 않았을 뿐이에요."
达菲，你......你说的是真心话？,達菲，你……你說的是真心話？,"""Duffy, you... are you speaking sincerely?""",「ダフィー、君……それ本当の言葉か？」,"더피, 너… 너 진심으로 하는 말이야?"
当然。我讨厌不告而别，所以今天我必须坦诚。,當然。我討厭不通告別，所以今天我必須坦誠。,"""Of course. I hate leaving things unsaid, so I had to be honest today.""",「もちろんです。無断で去るのは大嫌いです。だから今日、私は必ず誠実でなければなりません。」,"물론이에요. 전 불쑥 떠나는 걸 싫어해요, 그래서 오늘은 반드시 솔직해져야 했어요."
我确实对这座城市有了感情，还有你、达比，大家。,我確實對這座城市有了感情，還有你、達比，大家。,"""I've truly grown attached to this city, and to you, Darby, and everyone else.""",「私は確かにこの街に愛着を持ちました。それにあなたやダービー、みんなのことも。」,"전 정말 이 도시에 감정이 생겼어요, 그리고 성주님과, 다비와, 모두에게도요."
那您愿意原谅我吗？继续一起守护这里？,那您願意原諒我嗎？繼續一起守護這裡？,"""Then, will you forgive me? Continue to protect this place together?""",「では、あなたは私を許してくれますか？これからも一緒にここを守ってくれますか？」,그럼 성주님은 저를 용서해 주실 수 있나요? 계속 함께 여기를 지켜나갈 수 있을까요?
好吧，我理解你的初衷。事到如今，你的引导确实帮了我。,好吧，我理解你的初衷。事到如今，你的引導確實幫了我。,"""Alright, I understand your original intention. At this point, your guidance has indeed helped me.""",「よかろう、君の最初の考えは理解した。今となっては、君の導きは確かに私を助けてくれた。」,"좋아, 네 처음 뜻은 이해한다. 지금와서 보니, 네 지도가 정말 나를 도왔어."
谢谢您，城主。我保证以后不再隐瞒。,謝謝您，城主。我保證以後不再隱瞞。,"""Thank you, Lord. I promise I won't hide anything from you again.""",「ありがとうございます、城主。これからはもう隠し事をしないと約束します。」,"감사합니다, 성주님. 앞으로는 더 숨기지 않을 거라 약속할게요."
不过，有个条件——你得答应我，以后别再偷偷记录我的事。,不過，有個條件——你得答應我，以後別再偷偷記錄我的事。,"""But there's one condition—you have to promise me you won't secretly record my affairs anymore.""",「ただし、一つ条件がある——これからこっそり私のことを記録するのはやめると約束してくれ。」,하지만 조건이 하나 있어——네가 앞으로 몰래 내 일을 기록하지 않기로 약속해야 해.
哼，谁要记录您啊！我只是……只是为了城市好。,哼，誰要記錄您啊！我只是……只是為了城市好。,"""Hmph, who would record you! I just... just did it for the good of the city.""",「ふん、誰があなたのことなんか記録するものですか！私はただ……ただ街のためを思っているだけです！」,"흥, 누가 성주님 일을 기록하려고요! 전 그냥… 도시를 위해서일 뿐이에요."
笑了就好。那我们说定了，从今天起，真正合作。,笑了就好。那我們說定了，從今天起，真正合作。,"""It's good to see you smile. Then it's settled. From today on, we truly cooperate.""",「笑ってくれてよかった。では決まりだ。今日から本当に協力しよう。」,"웃는 거 보니 좋네. 그럼 우리 약속한 거야, 오늘부터 진정한 협력을 시작하는 거지."
嗯！我会继续辅助您，直到老城主回来，或者永远辅助您。,嗯！我會繼續輔助您，直到老城主回來，或者永遠輔助您。,"""Mhm! I'll continue to assist you until the old Lord returns, or assist you forever.""",「はい！私はあなたを補佐し続けます。前城主が戻ってくるまで、あるいは永遠にあなたを補佐します。」,"네! 전 계속 성주님을 보좌할 거예요, 옛 성주님이 돌아오실 때까지, 아니면 영원히 성주님을 보좌할게요."
达菲，谢谢你今天的坦诚。我们去喝杯茶吧。,達菲，謝謝你今天的坦誠。我們去喝杯茶吧。,"""Duffy, thank you for being honest today. Let's go have some tea.""",「ダフィー、今日の率直さに感謝する。お茶でも飲みに行こう。」,"더피, 오늘 솔직하게 말해줘서 고마워. 우리 차 한잔 하러 갈까?"
好的，城主。我先去泡茶，您稍等。,好的，城主。我先去泡茶，您稍等。,"""Alright, Lord. I'll go make the tea. Please wait a moment.""",「はい、城主。私がお茶を入れてきます。少々お待ちください。」,"네, 성주님. 제가 먼저 차를 우려올게요, 잠시만 기다려 주세요."
达菲尾巴轻轻摇晃，露出释然的微笑。,達菲尾巴輕輕搖晃，露出釋然的微笑。,Duffy's tail swayed gently as she gave a relieved smile.,ダフィーの尻尾が軽く揺れ、ほっとした微笑みを浮かべた。,"더피의 꼬리가 살짝 흔들리며, 안도하는 미소를 지었다."
你望着达菲的背影，长舒一口气，感到心中的重担终于放下。,你望著達菲的背影，長舒一口氣，感到心中的重擔終於放下。,"Watching her retreating back, you let out a long sigh, feeling a weight finally lift from your heart.",あなたはダフィーの後ろ姿を見つめ、深く息を吐き、心の重荷がついに下りたと感じた。,"당신은 더피의 뒷모습을 바라보며, 깊게 숨을 내쉬었다. 마음속의 무거운 짐이 드디어 내려앉는 것을 느꼈다."
"清晨,城主在书房处理公文,达菲拿着报告走进来。",清晨，城主在書房處理公文，達菲拿著報告走進來。,"Early morning, the Lord was handling documents in the study when Duffy entered with a report.",（翌朝、城主は書斎で公文書を処理している。ダフィーが報告書を持って入ってくる）,"아침, 성주는 서재에서 공문을 처리하고 있었다. 더피가 보고서를 들고 들어왔다."
城主，早安。这是昨日的公务汇总，需要您过目。,城主，早安。這是昨日的公務彙總，需要您過目。,"""Lord, good morning. Here's the summary of yesterday's official business for your review.""",「城主、おはようございます。これは昨日の公務のまとめです。ご確認ください。」,"성주님, 안녕하세요. 어제의 공무 집계입니다. 훑어보셔야 해요."
早，达菲。直接说吧，我边听边看。,早，達菲。直接說吧，我邊聽邊看。,"""Morning, Duffy. Just tell me while I look it over.""",「おはよう、ダフィー。直接言ってくれ。聞きながら見るから。」,"안녕, 더피. 직접 말해줘, 나는 들으면서 볼게."
首先，兽人部落的贸易协议已签署，往来货物增加了三成。,首先，獸人部落的貿易協議已簽署，往來貨物增加了三成。,"""First, the trade agreement with the Orc tribes has been signed. The flow of goods has increased by thirty percent.""",「まず、獣人部族との貿易協定が調印され、往来する貨物が三割増えました。」,"먼저, 오크 부족의 무역 협정이 서명됐고, 왕래하는 화물이 30% 증가했어요."
另外，学校的新课程安排好了，孩子们都很积极。,另外，學校的新課程安排好了，孩子們都很積極。,"""Also, the new school curriculum is arranged. The children are very engaged.""",「それに、学校の新しいカリキュラムも整い、子供たちは皆とても積極的です。」,"또, 학교의 새 커리큘럼이 준비됐고, 아이들이 모두 적극적이에요."
还有，东区的水源问题解决了，市民们表示感谢。,還有，東區的水源問題解決了，市民們表示感謝。,"""And the water source issue in the eastern district has been resolved. The citizens expressed their gratitude.""",「また、東地区の水源問題も解決し、市民の皆さんから感謝の言葉をいただいています。」,"게다가, 동구의 수원 문제가 해결됐고, 시민들이 감사를 표하고 있어요."
做得不错。这些事你处理得越来越熟练了。,做得不錯。這些事你處理得越來越熟練了。,"""Well done. You're handling these matters more and more proficiently.""",「よくやった。君はこれらの事柄をますます上手に処理できるようになったな。」,잘했어. 이런 일들을 네가 점점 더 숙련되게 처리하는구나.
哼，这只是分内工作。不过，有件事我想提一下。,哼，這只是分內工作。不過，有件事我想提一下。,"""Hmph, it's just my duty. But there's something I'd like to mention.""",「ふん、これは当然の仕事です。ただ、一つお伝えしたいことがあります。」,"흥, 이건 그냥 본분일 뿐이에요. 하지만, 한 가지 말씀드리고 싶은 게 있어요."
是关于最初的花店偷花案，您还记得吗?,是關於最初的花店偷花案，您還記得嗎？,"""It's about the initial flower shop theft case. Do you remember?""",「最初の花屋の花泥棒事件についてです。覚えていらっしゃいますか？」,"처음의 꽃가게 꽃 도난 사건에 관한 건데요, 기억나세요?"
花店偷花案?好像有点印象，但不是说误会了吗?,花店偷花案？好像有點印象，但不是說誤會了嗎？,"""The flower shop theft case? I vaguely recall, but wasn't it a misunderstanding?""",「花屋の花泥棒事件？少し覚えているような。誤解だったんじゃなかったか？」,"꽃가게 꽃 도난 사건? 약간 기억나는 것 같아, 하지만 오해라고 하지 않았나?"
是的，经调查是误会，那女孩只是捡了掉落的花种。,是的，經調查是誤會，那女孩只是撿了掉落的花種。,"""Yes, the investigation confirmed it was a misunderstanding. The girl only picked up fallen flower seeds.""",「はい、調査の結果、誤解でした。あの少女はただ落ちていた花の種を拾っただけでした。」,"네, 조사 결과 오해였어요, 그 소녀는 그냥 떨어진 꽃씨를 주운 거였죠."
但调查过程中，我发现那女孩有点奇怪。,但調查過程中，我發現那女孩有點奇怪。,"""But during the investigation, I noticed something odd about that girl.""",「でも調査の過程で、私はあの少女が少し変だということに気づいたんです。」,"하지만 조사 과정에서, 저는 그 소녀가 좀 이상하다는 걸 발견했어요."
奇怪?怎么个奇怪法?,奇怪？怎麼個奇怪法？,"""Odd? In what way?""",「変？どういうことだ？」,이상하다고? 어떻게 이상한데?
她有时自称琳芙，有时又叫自己忒菲丝，行为像两个人。,她有時自稱琳芙，有時又叫自己忒菲絲，行為像兩個人。,"""She sometimes calls herself Lynf, and other times Thefis. Her behavior is like two different people.""",「彼女は時々自分をリンクと呼び、時にはテーフィスと呼び、行動が二人の人間のようでした。」,"그녀는 가끔 자신을 린후라고 부르다가, 또 때로는 테베스라고 부르더라고요, 행동이 두 사람 같아요."
邻居们说，她跳舞时像精灵，但平时又像普通人类。,鄰居們說，她跳舞時像精靈，但平時又像普通人類。,"""Neighbors say she dances like an Elf, but otherwise seems like an ordinary human.""",「近所の人たちは、彼女が踊る時はエルフのようだが、普段は普通の人間のようだと言います。」,"이웃들 말론, 그녀가 춤출 땐 정령 같지만, 평소엔 또 평범한 인간 같대요."
琳芙和忒菲丝?这名字有点耳熟，是那个在落埃之城跳舞的女孩?,琳芙和忒菲絲？這名字有點耳熟，是那個在落埃之城跳舞的女孩？,"""Lynf and Thefis? Those names sound familiar. Is she the girl who danced in the fallen city?""",「リンクとテーフィス？この名前はどこかで聞いたことがある。落埃の街で踊っていた少女か？」,"린후와 테베스? 이 이름 어디선가 들어본 것 같아, 에델 성에서 춤추던 그 소녀?"
对，就是她。她似乎有双重身份，或者说两个灵魂。,對，就是她。她似乎有雙重身份，或者說兩個靈魂。,"""Yes, that's her. She seems to have a dual identity, or perhaps two souls.""",「はい、彼女です。彼女は二重の身分を持っているようです。あるいは、二つの魂が。」,"네, 바로 그 애예요. 그녀는 이중 신분을 가진 것 같아요, 혹은 두 영혼이 있는 거죠."
我查过记录，琳芙是精灵，忒菲丝是人类，但她们好像融合了。,我查過記錄，琳芙是精靈，忒菲絲是人類，但她們好像融合了。,"""I checked the records. Lynf is an Elf, and Thefis is human, but they seem to have merged.""",「記録を調べたところ、リンクはエルフで、テーフィスは人間ですが、彼女たちは融合しているようです。」,"제가 기록을 조사해봤는데, 린후는 정령이고 테베스는 인간인데, 하지만 그들은 서로 융합한 것 같아요."
融合?这听起来像魔法或诅咒，需要深入调查吗?,融合？這聽起來像魔法或詛咒，需要深入調查嗎？,"""Merged? That sounds like magic or a curse. Should we investigate further?""",「融合？それは魔法か呪いのようだ。もっと深く調査すべきか？」,"융합? 이건 마법이나 저주 같아 들리네, 더 깊이 조사해야 할까?"
"不必了,案件已结,而且那女孩现在过得平静,没惹麻烦",不必了，案件已結，而且那女孩現在過得平靜，沒惹麻煩。,"""No need. The case is closed, and the girl is living peacefully now, causing no trouble.""",「いいえ、事件は既に解決済みですし、あの少女は今は平穏に暮らしていて、問題も起こしていません。」,"아뇨 됐어요, 사건은 이미 종결됐고, 게다가 그 소녀는 지금 평온하게 지내고 있어요, 문제를 일으키지 않죠."
只是我觉得蹊跷，才向您汇报。毕竟涉及精灵和人族。,只是我覺得蹊蹺，才向您匯報。畢竟涉及精靈和人族。,"""I just found it strange and reported it to you, especially since it involves Elves and humans.""",「ただ不思議に思ったので、ご報告しました。エルフと人間族に関わることですから。」,"다만 제가 이상하게 느껴져서, 성주님께 보고한 거예요. 결국 정령과 인간족이 관련되어 있으니까요."
我明白了。既然没事，就暂且放下吧。,我明白了。既然沒事，就暫且放下吧。,"""I understand. Since there's no issue, let's set it aside for now.""",「わかった。問題がないなら、ひとまず置いておこう。」,"알겠어. 일이 없으니, 잠시 접어두자."
好的。另外，下周的庆典准备就绪，您要出席吗?,好的。另外，下週的慶典準備就緒，您要出席嗎？,"""Alright. Also, preparations for next week's festival are complete. Will you attend?""",「はい。それから、来週の祝祭の準備は整いました。ご出席されますか？」,"네. 또, 다음 주 축제 준비는 다 됐어요, 성주님 참석하실 건가요?"
当然，我会去。达菲，你对那女孩的事似乎很在意?,當然，我會去。達菲，你對那女孩的事似乎很在意？,"""Of course, I'll be there. Duffy, you seem quite concerned about that girl's situation?""",「もちろん、行くよ。ダフィー、君はあの少女のことを気にかけているようだな？」,"당연히, 갈 거야. 더피, 너 그 소녀 일에 신경을 쓰는 것 같네?"
有点吧。她让我想起老城主说的，灵魂和记忆的羁绊。,有點吧。她讓我想起老城主說的，靈魂和記憶的羈絆。,"""A little. She reminds me of what the old Lord said about the bonds between souls and memories.""",「少しは。彼女は前城主の言った、魂と記憶の絆を思い起こさせます。」,"조금요. 그녀는 제게 옛 성주님께서 말씀하신, 영혼과 기억의 인연이 생각나게 해요."
羁绊吗?或许每个生命都有秘密，只要不危害他人，就随它去吧。,羈絆嗎？或許每個生命都有祕密，只要不危害他人，就隨它去吧。,"""Bonds, huh? Perhaps every life has its secrets. As long as it doesn't harm others, we should let it be.""",「絆か？もしかしたら全ての命には秘密があるのかもしれない。他人に危害を加えなければ、そのままにしておけばいい。」,"인연이라고? 아마 모든 생명에는 비밀이 있겠지, 타인에게 해를 끼치지만 않는다면, 그냥 내버려 두는 게 좋아."
您说得对。那我不多说了，先去忙庆典的事。,您說得對。那我不多說了，先去忙慶典的事。,"""You're right. Then I won't say more. I'll go focus on the festival preparations.""",「おっしゃる通りです。ではこれ以上は言いません。まず祝祭のことに取り掛かります。」,"성주님 말씀이 맞아요. 그럼 더 말하지 않을게요, 먼저 축제 일 보러 갈게요."
达菲，等等。谢谢你告诉我这些，我会留心的。,達菲，等等。謝謝你告訴我這些，我會留心的。,"""Duffy, wait. Thank you for telling me this. I'll keep it in mind.""",「ダフィー、待ってくれ。これらのことを教えてくれてありがとう。気にかけておくよ。」,"더피, 잠깐. 이런 이야기 해줘서 고마워, 나도 마음에 새겨둘게."
嗯，城主。如果您好奇，我可以再查查，但我觉得没必要。,嗯，城主。如果您好奇，我可以再查查，但我覺得沒必要。,"""Mhm, Lord. If you're curious, I could look into it more, but I don't think it's necessary.""",「はい、城主。もし興味があれば、もう少し調べることもできますが、必要ないと思います。」,"음, 성주님. 만약 궁금하시다면, 제가 다시 조사해볼 수는 있어요. 하지만 필요없다고 생각해요."
不用了，专注眼前工作吧。去吧。,不用了，專注眼前工作吧。去吧。,"""No need. Let's focus on the work at hand. You may go.""",「いいや、今は目の前の仕事に集中しよう。行ってくれ。」,"됐어, 눈앞의 일에 집중하자. 가 봐."
好的，我告退了。,好的，我告退了。,"""Understood. I'll take my leave.""",「はい、失礼します。」,"네, 그럼 실례할게요."
达菲离开后，城主若有所思地望向窗外。,達菲離開後，城主若有所思地望向窗外。,"After Duffy left, the Lord gazed thoughtfully out the window.",ダフィーが去った後、城主は思案深げに窓の外を見つめた。,"더피가 떠난 후, 성주는 무언가 생각에 잠긴 듯 창밖을 바라보았다."
琳芙和忒菲丝......双生疑云，这世界果然充满奇妙。,琳芙和忒菲絲……雙生疑雲，這世界果然充滿奇妙。,Lynf and Thefis... a twin mystery. This world is truly full of wonders.,「リンクとテーフィス……二つの魂の謎。この世界はやはり不思議に満ちている。」,"린후와 테베스…… 쌍둥이 같은 수수께끼, 이 세상은 역시 기이한 일로 가득하구나."
