Simplified_Text,Traditional_Text,English_Text,Japanese_Text,Korean_Text
我决定亲自前往，与兽人部落进行谈和。,我決定親自前往，與獸人部落進行談和。,"""I have decided to go personally to negotiate peace with the Orc tribes.""",「私は、自ら獣人部族へ赴き、和平交渉を行うことに決めました。」,"""나는 직접 가서, 오크 부족과 평화 협상을 하기로 결정했어."""
什么？你要亲自去？这太危险了！,什麼？你要親自去？這太危險了！,"""What? You're going personally? That's far too dangerous!""",「何ですって？あなたが自ら行く？それは危険すぎるわ！」,"""뭐? 직접 간다고? 너무 위험해!"""
哦？有趣。那些家伙可不好对付，你确定吗？,哦？有趣。那些傢伙可不好對付，你確定嗎？,"""Oh? Interesting. Those guys aren't easy to deal with. Are you sure?""",「おや？面白い。あの連中は手強いぞ、本当にいいのか？」,"""오? 재미있네. 그 녀석들 다루기 힘들다구. 확실해?"""
是的，和平需要诚意，我作为城主必须出面。,是的，和平需要誠意，我作為城主必須出面。,"""Yes. Peace requires sincerity. As the Lord, I must show my face.""",「ええ、和平には誠意が必要です。私は城主として出向かなければなりません。」,"""응, 평화에는 성의가 필요해. 나는 성주로서 반드시 나서야 해."""
可是……你的安全怎么办？那里局势不稳定，冲突刚发生过。,可是……你的安全怎麼辦？那裡局勢不穩定，衝突剛發生過。,"""But... what about your safety? The situation there is unstable; conflicts just occurred.""",「でも……あなたの安全はどうするの？あの地域は情勢が不安定で、衝突が起きたばかりですよ。」,"""하지만… 당신의 안전은 어떻게 할 거예요? 그곳은 상황이 불안정하고, 충돌도 막 일어났는데."""
我理解你的决心，但谈和之事可以交给经验丰富的外交官。,我理解你的決心，但談和之事可以交給經驗豐富的外交官。,"""I understand your resolve, Lord, but peace talks could be entrusted to experienced diplomats.""",「ダフィー、君の決意は理解する。だが、和平交渉は経験豊かな外交官に任せることもできる。」,"당신의 결심은 이해하지만, 화평 교섭은 경험 많은 외교관에게 맡길 수도 있습니다."
尼可尔虽然优秀，但这次需要更高级别的代表，才能显示出我们的诚意。,尼可爾雖然優秀，但這次需要更高級別的代表，才能顯示出我們的誠意。,"Nicole is indeed capable, but this time we need a higher-level representative to truly show our sincerity.",「ニコールは優秀だが、今回はより上位の代表が必要だ。そうでなければ我々の誠意を示せない。」,"니콜도 훌륭하지만, 이번에는 더 높은 수준의 대표가 나서야 우리의 성의를 보여줄 수 있습니다."
我……我觉得你不该冒险。但如果你坚持，我会支持。,我……我覺得你不該冒險。但如果你堅持，我會支持。,"I... I still think you shouldn't take the risk. But if you insist, I'll support you.",「私……あなたが危険に身をさらすべきではないと思う。でももしどうしてもというなら、私は支持する。」,"저… 당신이 위험을 감수하시는 건 안 된다고 생각해요. 하지만 만약 고집하신다면, 저는 지지할게요."
支支吾吾什么？达菲，你总是这么犹豫。你，我也要去！,支支吾吾什麼？達菲，你總是這麼猶豫。你，我也要去！,"Hesitating about what, Duffy? You're always so indecisive. You! I'm going too!",「何をモジモジしてるんだ？ダフィー、お前はいつもそうだ。なあ、私も行くぞ！」,"우물쭈물거리는 게 뭐야? 더피, 너는 항상 이렇게 망설이네. 당신, 나도 갈 거야!"
莉莉丝，你没必要卷入这种事务。,莉莉絲，你沒必要捲入這種事務。,"Lilith, you don't need to get involved in this kind of affair.",「リリス、君までこんなことに巻き込まれる必要はない。」,"릴리스, 당신은 이런 일에 끼어들 필요 없어요."
怎么？嫌我碍事？我可是你的魔法顾问，我的幻术和探测魔法能帮上大忙。,怎麼？嫌我礙事？我可是你的魔法顧問，我的幻術和探測魔法能幫上大忙。,What? Think I'm in the way? I'm your magical advisor. My illusions and detection magic can be of great help.,「なんだ？邪魔だと言うのか？私は君の魔法顧問だ。私の幻術と探知魔法は大いに役立つぞ。」,왜? 내가 방해된다고? 난 당신의 마법 고문이야. 나의 환술과 탐지 마법이 큰 도움이 될 수 있다고.
莉莉丝，这不是儿戏。请你三思。,莉莉絲，這不是兒戲。請你三思。,"Lilith, this isn't a game. Please reconsider.",「リリス、これは子供の遊びじゃない。よく考えてほしい。」,"릴리스, 이건 장난이 아니에요. 다시 한번 생각해 보세요."
阿古丽娅，我知道你担心，但这是必要的。只有我亲自去，才能打破邻国散布的谣言。,阿古麗婭，我知道你擔心，但這是必要的。只有我親自去，才能打破鄰國散佈的謠言。,"Aguria, I know you're concerned, but this is necessary. Only by going personally can I break the rumors spread by the neighboring country.",「アグリア、君の心配はわかる。だが、これが必要なんだ。私が直接行くことでしか、隣国が撒き散らすデマを打ち消せない。」,"아구리아, 당신의 걱정은 알겠지만, 이건 필수적인 일이에요. 제가 직접 가야만 인접 국가가 퍼뜨린 소문을 깰 수 있어요."
你还记得老城主的教导吗？安全第一。万一这是陷阱……,你還記得老城主的教導嗎？安全第一。萬一這是陷阱……,Do you remember the old Lord's teaching? Safety first. What if this is a trap...,「前城主様の教えを覚えていますか？安全第一です。万一これが罠だったら……」,옛 성주님의 가르침 기억하세요? 안전이 제일이에요. 만약 함정이라면…
达菲，别拿老家伙说事。我的魔法能保护他，至少比某些只会挥舞长剑的人灵活。,達菲，別拿老傢伙說事。我的魔法能保護他，至少比某些只會揮舞長劍的人靈活。,"Duffy, don't bring the old man into this. My magic can protect him—it's at least more flexible than someone who only knows how to swing a longsword.",「ダフィー、古い話を引っ張り出すな。私の魔法で彼を守れる。少なくとも、長剣を振り回すだけの誰かよりは機動的だ。」,"더피, 늙은이 이야기 꺼내지 마. 내 마법이 그를 지켜줄 수 있어. 적어도 칼만 휘두르는 사람들보다는 훨씬 유연하니까."
如果你执意要去，请允许我带领骑士团精锐护送。这是底线。,如果你執意要去，請允許我帶領騎士團精銳護送。這是底線。,"If you insist on going, please allow me to lead an elite Knight escort. That is my bottom line.",「もしあなたがどうしても行かれるなら、私に騎士団の精鋭を率いて護衛させてください。これは譲れない線です。」,"만약 꼭 가신다면, 제가 기사단 정예병을 이끌고 호송하는 걸 허락해 주세요. 이건 최소한의 조건입니다."
阿古丽娅，我不想动用太多兵力，以免引起兽人方的误解和紧张。,阿古麗婭，我不想動用太多兵力，以免引起獸人方的誤解和緊張。,"Aguria, I don't want to deploy too many troops to avoid misunderstanding and tension from the Orc side.",「アグリア、あまり多くの兵力を動かしたくない。獣人側の誤解と緊張を招きかねない。」,"아구리아, 병력을 너무 많이 동원하면 오크족 측의 오해와 긴장을 초래할까 봐 걱정이에요."
不！我必须坚持。谈和路上可能有埋伏，邻国的探子无处不在。我不能让你独自涉险。,不！我必須堅持。談和路上可能有埋伏，鄰國的探子無處不在。我不能讓你獨自涉險。,No! I must insist. The peace talks route might have ambushes; spies from the neighboring country are everywhere. I cannot let you walk into danger alone.,「いいえ！私はどうしても主張します。和平への道中には伏兵がいるかもしれない。隣国の偵察者はどこにでもいます。あなた一人を危険にさらすわけにはいきません。」,"아니요! 저는 반드시 고집하겠습니다. 평화 가는 길에 매복이 있을 수 있고, 인접 국가의 첩자들이 어디에나 있으니까요. 당신이 혼자 위험에 빠지게 둘 수 없어요."
阿古丽娅团长说得对，你不能独自行动。至少……至少要让可靠的人跟着。,阿古麗婭團長說得對，你不能獨自行動。至少……至少要讓可靠的人跟著。,Captain Aguria is right. You can't go alone. At the very least... at least have reliable people accompany you.,「アグリア団長の言う通りだ。あなたは単独行動をすべきではない。少なくとも……少なくとも信頼できる者を同行させて。」,아구리아 단장 말씀이 맞아요. 혼자 행동해서는 안 돼요. 적어도… 믿을 만한 사람을 데리고 가야 해요.
喂，你们别吵了。这样吧，我们一起去。阿古丽娅带一小队精锐明着护卫，我用魔法在暗处策应。这样既能保证安全，也不至于显得声势浩大。,喂，你們別吵了。這樣吧，我們一起去。阿古麗婭帶一小隊精銳明著護衛，我用魔法在暗處策應。這樣既能保證安全，也不至於顯得聲勢浩大。,"Hey, stop arguing. How about this: we all go together. Aguria provides an open escort with a small elite team, and I'll support from the shadows with magic. That way, we ensure safety without appearing overly imposing.",「おい、もう喧嘩はやめろ。こうしよう、私たち全員で行くんだ。アグリアは精鋭小隊を率いて明らかな護衛につく。私は魔法で暗から策応する。これで安全は確保できるし、大げさに見えることもない。」,"저기, 너희들 싸우지 마. 이렇게 하자, 우리 같이 가. 아구리아는 소수 정예병을 데리고 명시적으로 호위하고, 난 마법으로 암암리에 지원할게. 이렇게 하면 안전도 보장되고, 너무 대규모로 보이지도 않아."
莉莉丝，你的能力我很欣赏，但……,莉莉絲，你的能力我很欣賞，但……,"Lilith, I appreciate your abilities, but...",「リリス、君の能力は高く買っているが……」,"릴리스, 당신의 능력은 인정하지만…"
这个方案……可以考虑。我会只挑选尼可尔、奥兰多等少数几人，他们擅长侦察和外交，能够低调行事。,這個方案……可以考慮。我會只挑選尼可爾、奧蘭多等少數幾人，他們擅長偵察和外交，能夠低調行事。,"This plan... is worth considering. I will only select a few, like Nicole and Orlando. They excel in reconnaissance and diplomacy and can operate discreetly.",「この案……考慮に値します。私はニコール、オーランドなど少数のみを選抜します。彼らは偵察と外交に長け、目立たずに行動できます。」,"이 방안… 고려해 볼 만해요. 저는 니콜, 올랜도 등 소수만 선발하겠습니다. 그들은 정찰과 외교에 능숙해서 은밀히 행동할 수 있어요."
尼可尔？她很厉害……但你真要去吗？我还是不放心。,尼可爾？她很厲害……但你真要去嗎？我還是不放心。,Nicole? She's very capable... But are you really going? I'm still uneasy.,「ニコール？彼女は確かに強い……でも本当に行くの？やっぱり心配だ。」,니콜? 그녀 정말 대단한데… 정말 가시는 거예요? 아직도 불안한데…
达菲，你刚才说支持我的，现在又动摇了？,達菲，你剛才說支持我的，現在又動搖了？,"Duffy, you just said you'd support me. Are you wavering now?",「ダフィー、さっきは私を支持すると言ったのに、今また揺らいでいるのか？」,"더피, 아까는 저를 지지한다고 했잖아요, 지금 또 흔들리는 거예요?"
不是动摇！我只是……担心。但我会帮你们准备行装和必需物资。,不是動搖！我只是……擔心。但我會幫你們準備行裝和必需物資。,Not wavering! I'm just... worried. But I'll help prepare your gear and necessary supplies.,「揺らいでなんかいない！ただ……心配なだけ。でも、私は装備や必要な物資の準備を手伝うわ。」,흔들리는 게 아니라고! 그냥… 걱정될 뿐이야. 하지만 내가 너희 행장과 필요한 물자를 준비해 줄게.
达菲，别啰嗦了。你，快决定吧。时间不等人。,達菲，別囉嗦了。你，快決定吧。時間不等人。,"Duffy, stop dithering. You, make a decision. Time won't wait.",「ダフィー、もういいから。なあ、早く決めろ。時間は待ってくれない。」,"더피, 잔소리 그만해. 당신, 빨리 결정해. 시간이 없어."
时间紧迫。如果你同意这个联合方案，我立刻就去集结队员，明天清晨即可出发。,時間緊迫。如果你同意這個聯合方案，我立刻就去集結隊員，明天清晨即可出發。,"Time is short. If you agree to this joint plan, I'll immediately assemble the team. We can depart at dawn tomorrow.",「時間は限られている。もしあなたがこの合同案を了承されるなら、私は直ちに隊員を集結させ、明日の明け方に出発できます。」,"시간이 없어요. 만약 이 연합 방안에 동의하신다면, 전 즉시 대원들을 소집해서 내일 아침 출발할 수 있어요."
看来这是最优解了。好吧，阿古丽娅，我同意你带领精锐同行。莉莉丝，也麻烦你一起了。,看來這是最優解了。好吧，阿古麗婭，我同意你帶領精銳同行。莉莉絲，也麻煩你一起了。,"It seems this is the optimal solution. Very well, Aguria, I agree to have you lead the elite escort. Lilith, your assistance is also appreciated.",「これが最善の解決策のようだ。よし、アグリア、君が精鋭を率いて同行することに同意する。リリス、君もよろしく頼む。」,"이게 최선의 해결책인 것 같군요. 좋아요, 아구리아, 당신이 정예병을 데리고 가는 것에 동의합니다. 릴리스, 당신도 함께 부탁해요."
哼，这还差不多。记住，你又欠我一个人情。,哼，這還差不多。記住，你又欠我一個人情。,"Hmph, that's more like it. Remember, you owe me another favor.",「ふん、それでこそ。覚えておけよ、また一つ借りができたな。」,"흥, 이제야 말이 되네. 기억해, 당신은 또 나한테 빚을 진 거야."
谢谢你！我会确保万无一失。我这就去安排路线和防卫计划。,謝謝你！我會確保萬無一失。我這就去安排路線和防衛計劃。,Thank you! I will ensure everything is foolproof. I'll go arrange the route and defense plan now.,「ありがとうございます！万全を期します。直ちにルートと防衛計画の準備に向かいます。」,고마워요! 만전을 기하겠습니다. 전 즉시 경로와 방어 계획을 준비하러 가겠습니다.
我会通知后勤准备物资和补给。但你们一定要小心，随时保持联络。,我會通知後勤準備物資和補給。但你們一定要小心，隨時保持聯絡。,I'll notify logistics to prepare supplies and provisions. But you must be careful and maintain communication at all times.,「私は後方支援に物資と補給の準備をさせます。でも、どうか気を付けて。常に連絡を保ってください。」,"제가 후방 지원을 통해 물자와 보급품을 준비하겠습니다. 하지만 꼭 조심하세요, 수시로 연락하세요."
达菲，感谢你的支持。我知道你一直很可靠。城堡这边就拜托你了。,達菲，感謝你的支持。我知道你一直很可靠。城堡這邊就拜託你了。,"Duffy, thank you for your support. I know you've always been reliable. I leave the castle in your care.",「ダフィー、サポートをありがとう。君の頼もしさはよくわかっている。城の方は君に任せた。」,"더피, 지지해줘서 고마워. 네가 항상 믿음직하다는 걸 알아. 성은 네게 부탁할게."
这是我该做的。你一定要平安回来。,這是我該做的。你一定要平安回來。,It's my duty. You must come back safely.,「当然のことをしただけです。あなたは必ず無事で戻ってきてください。」,당연한 일이에요. 꼭 무사히 돌아오세요.
放心，有我在，没人能伤到他。倒是你，阿古丽娅，你的骑士们可别拖后腿。,放心，有我在，沒人能傷到他。倒是你，阿古麗婭，你的騎士們可別拖後腿。,"Don't worry. With me here, no one can harm him. More importantly, Aguria, don't let your knights hold us back.",「心配するな、私がついている。誰も彼を傷つけられない。むしろアグリア、お前の騎士たちが足手まといになるんじゃないだろうな？」,"안심해, 내가 있으니까 그를 다치게 할 사람 없어. 오히려 아구리아, 네 기사들이 발목 잡지만 않으면 좋겠다."
莉莉丝，做好你分内的事。我的队员个个都是好手。那么，我们分头准备吧。,莉莉絲，做好你分內的事。我的隊員個個都是好手。那麼，我們分頭準備吧。,"Lilith, focus on your own responsibilities. Every member of my team is highly skilled. Then, let's prepare separately.",「リリス、あなたはあなたの役目を果たしてください。私の隊員は皆、腕利きです。では、それぞれ準備を始めましょう。」,"릴리스, 네 분내 일이나 잘해. 내 대원들은 모두 실력자야. 그럼, 우리 각자 준비하러 가자."
你看着三人虽然争执但最终达成共识，心中稍安。你知道这次旅程充满未知，但为了和平，这一步必须迈出。,你看著三人雖然爭執但最終達成共識，心中稍安。你知道這次旅程充滿未知，但為了和平，這一步必須邁出。,"You watched as the three, despite their disputes, finally reached a consensus, feeling somewhat relieved. You knew this journey was full of unknowns, but for peace, this step had to be taken.",三人が口論しながらも最終的に合意に至ったのを見て、あなたは少し安心した。この旅が未知に満ちていることはわかっている。だが、平和のために、この一歩を踏み出さなければならない。,"당신은 세 사람이 비록 다툼은 있었지만 결국 합의를 본 모습을 보며 마음이 조금 놓였다. 이번 여정이 미지의 세계로 가득하지만, 평화를 위해 이 한 걸음을 반드시 내딛어야 함을 알았다."
次日清晨，城堡广场上已是人头攒动。你与阿古丽娅并肩走出，看到达菲、莉莉丝以及曙光骑士团的成员们早已在此等候。,次日清晨，城堡廣場上已是人頭攢動。你與阿古麗婭並肩走出，看到達菲、莉莉絲以及曙光騎士團的成員們早已在此等候。,"The next morning, the castle square was already bustling with activity. You walked out side by side with Aguria and saw Duffy, Lilith, and the members of the Dawn Knight Order already waiting.",翌朝早く、城の広場にはすでに人の気配が集まっていた。あなたとアグリアが並んで歩み出ると、ダフィー、リリス、そして暁光騎士団のメンバーたちがすでに待機しているのが見えた。,"다음날 아침, 성 광장에는 이미 사람들이 모여들었다. 당신은 아구리아와 나란히 걸어 나왔고, 더피, 릴리스, 그리고 새벽 기사단원들이 이미 기다리고 있는 것을 보았다."
一切准备就绪，就等你们了。,一切準備就緒，就等你們了。,"""Everything is ready. Just waiting for you.""",「準備はすべて整いました。あとはあなた方をお待ちするだけです。」,"""모든 준비는 끝났어요, 여러분만 오시면 돼요."""
我们来了！没迟到吧？,我們來了！沒遲到吧？,"""We're here! Not late, are we?""",「着いたぞ！遅れてないよな？」,"""왔어요! 늦지 않았죠?"""
路上清理了一点小障碍，所以耽搁了片刻。,路上清理了一點小障礙，所以耽擱了片刻。,"""We cleared a minor obstacle on the way, so we were slightly delayed.""",「道中で小さな障害を片付けていたので、少し遅れた。」,"""길에서 작은 장애물을 좀 처리해서 조금 늦었어요."""
时间刚好。,時間剛好。,"""Timing is perfect.""",「時間はちょうど良い。」,"""시간 딱 맞았어."""
尤蕾拉，露卡，归队。,尤蕾拉，露卡，歸隊。,"""Eurella, Luka, fall in.""",「ユーレラ、ルカ、帰隊。」,"""유렐라, 루카, 대열에 합류해."""
哼，每次都这么毛躁，就不能更稳妥些吗？,哼，每次都這麼毛躁，就不能更穩妥些嗎？,"""Hmph, always so reckless. Can't you be more careful?""",「ふん、いつもこうして慌ただしいんだから、もう少し慎重にできないものかしら。」,"""흥, 매번 이렇게 경망스러워, 좀 더 안정적으로 할 수는 없는 거야?"""
达菲姐姐别生气嘛，你看，我特意给你摘了最新鲜的星星草！,達菲姐姐別生氣嘛，你看，我特意給你摘了最新鮮的星星草！,"""Don't be mad, Sister Duffy! Look, I picked the freshest star grass for you!""",「ダフィーお姉さん怒らないでよ、見て、一番新鮮な星明かり草を摘んできたんだから！」,"""더피 언니 화내지 마~ 봐봐, 내가 특별히 언니한테 가장 신선한 별빛풀을 딴 거야!"""
谁、谁要你的草啊！……不过还是谢谢了。,誰、誰要你的草啊！……不過還是謝謝了。,"""Wh-who wants your grass! ... But thank you anyway.""",「誰が、誰があなたの草なんか欲しがるっての！……でも、ありがとう。」,"""누가, 누가 네 풀을 원하겠어! … 그래도 고마워."""
报告团长，人员已清点完毕，可以出发了。,報告團長，人員已清點完畢，可以出發了。,"""Reporting, Captain. All personnel accounted for. Ready to depart.""",「団長、報告します。人員点呼完了しました。出発可能です。」,"""단장님 보고합니다. 인원 점검 완료했습니다. 출발할 수 있습니다."""
希娜伽，我们离开期间，骑士团的日常事务就交由你全权负责。,希娜伽，我們離開期間，騎士團的日常事務就交由你全權負責。,"""Synaga, while we're away, you are fully responsible for the Knights' daily affairs.""",「キナカ、私たちの不在中、騎士団の日常業務はあなたに一任する。」,"""키나카, 우리가 없는 동안 기사단의 일상 업무는 전적으로 당신에게 맡기겠습니다."""
明白，请放心。,明白，請放心。,"""Understood. Please rest assured.""",「了解しました。ご安心ください。」,"""알겠습니다. 안심하세요."""
团长，请务必保重。,團長，請務必保重。,"""Captain, please take care of yourself.""",「団長、どうかご無事で。」,"""단장님, 꼭 건강히 돌아오세요."""
阿古丽娅，凡事别太勉强，安全第一。,阿古麗婭，凡事別太勉強，安全第一。,"""Aguria, don't push yourself too hard. Safety first.""",「アグリア、無理は禁物だよ、安全第一で。」,"""아구리아, 무리하지 말고 안전 제일이에요."""
谢谢你们，我会的。,謝謝你們，我會的。,"""Thank you. I will.""",「ありがとう、そうする。」,"""고마워요, 그렇게 할게요."""
克丽奥娜与海芙约特已经按计划先行一步了。,克麗奧娜與海芙約特已經按計劃先行一步了。,"""Cliodna and Herfjotur have already set off ahead of schedule as planned.""",「クレオナとヘフィヨルドは計画通り、先に出発しました。」,"""크리오나와 허프조투어는 이미 계획대로 먼저 출발했어요."""
也就是说，我们这一路是直奔兽人部落进行和谈？,也就是說，我們這一路是直奔獸人部落進行和談？,"""So, we are heading directly to the Orc tribe for peace talks?""",「つまり、私たちは一路、獣人部族へ向かい和平交渉を行うわけですね？」,"""그러니까 우리 이번 길은 오크 부족으로 곧장 가서 평화 협상을 하는 거군요?"""
是的，这次任务的核心就在于此。,是的，這次任務的核心就在於此。,"""Yes. That is the core mission this time.""",「ええ、今回の任務の核心はそこにある。」,"""네, 이번 임무의 핵심은 바로 그거예요."""
