Simplified_Text,Traditional_Text,English_Text,Japanese_Text,Korean_Text
希望还有下次。现在保持安静，森林里可能有危险。,希望還有下次。現在保持安靜，森林裡可能有危險。,"""Let's hope there is a next time. Now remain quiet. There may be dangers in the forest.""",次があると良いが。今は静かに。森には危険があるかもしれない。,"다음이 있길 바란다. 이제 조용히 해, 숲 속에 위험이 있을 수도 있어."
吉蒙里，通过地脉感知，附近没有异常。,吉蒙里，通過地脈感知，附近沒有異常。,"""Gremory, leyline perception shows no abnormalities nearby.""",ギモンリ、地脈による感知では、近くに異常はありません。,"기몬리, 대지의 맥락을 통해 감지해 보니, 근처에 이상은 없습니다."
好。继续前进。,好。繼續前進。,"""Good. Continue.""",よし。進もう。,좋아. 계속 전진한다.
小队成员们紧张地跟随，你注意到森林中的光线逐渐变得柔和，空气中弥漫着魔法的气息。,小隊成員們緊張地跟隨，你注意到森林中的光線逐漸變得柔和，空氣中瀰漫著魔法的氣息。,"The squad members followed tensely. You noticed the light within the forest gradually softened, and the air was filled with a magical aura.",チームのメンバーは緊張してついていく。あなたは森の中の光が次第に柔らかくなり、空気に魔法の気配が満ちていることに気づく。,"소대원들은 긴장하며 따라갔고, 당신은 숲 속의 빛이 점점 부드러워지며 공기 중에 마법의 기운이 감돌고 있음을 알아차렸다."
你们的护卫队很专业。,你們的護衛隊很專業。,"""Your patrol is very professional.""",あなた方の護衛はプロだね。,당신들의 호위대는 아주 전문적이군요.
这是我们的职责。大地告诉我们一切。,這是我們的職責。大地告訴我們一切。,"""It is our duty. The earth tells us everything.""",これが我々の役目だ。大地がすべてを教えてくれる。,이것은 우리의 책임이니까요. 대지가 우리에게 모든 것을 알려줍니다.
姐姐，别炫耀了。快走吧。,姐姐，別炫耀了。快走吧。,"""Sister, stop showing off. Let's keep moving.""",姉様、自慢は後にして。さっさと行きましょう。,"언니, 자랑하지 말고 빨리 가요."
嘻嘻，薇薇安，你总是这么严肃。,嘻嘻，薇薇安，你總是這麼嚴肅。,"Heehee, Vivian, you're always so serious.",へへっ、ビビアン、あなたはいつもそんなに厳しいんだね。,"히히, 비비안, 너는 항상 이렇게 진지하기만 해."
吉蒙里，专注任务。,吉蒙里，專注任務。,"Gremory, focus on the mission.",ギモンリ、任務に集中しなさい。,"기몬리, 임무에 집중해."
我们听说精灵族三姐妹很厉害，今天见到了。,我們聽說精靈族三姊妹很厲害，今天見到了。,We've heard the three Elven sisters are formidable. Seeing you today confirms it.,私たち、精霊族の三姉妹が強いって聞いてたけど、今日会えて光栄だよ。,"우리는 엘프족 삼자매가 아주 뛰어나다는 말을 들었는데, 오늘 직접 만났네요."
哦？你听说过我们？,哦？你聽說過我們？,Oh? You've heard of us?,あら？私たちのことを知っているの？,오? 우리에 대해 들었다고?
是的，吉蒙里操控大地，薇薇安月光之力，阿斯莫德光影魔法。,是的，吉蒙里操控大地，薇薇安月光之力，阿斯莫德光影魔法。,"Yes. Gremory commands the earth, Vivian wields moonlight power, and Asmodeus masters light-shadow magic.",ええ、ギモンリは大地を操り、ビビアンは月光の力、アスモードは光と影の魔法を使うって。,"네, 기몬리는 대지를 조종하고, 비비안은 달빛의 힘, 아스모데우스는 빛과 그림자 마법을 쓰죠."
消息传得真远。但请别分散注意力。,消息傳得真遠。但請別分散注意力。,Word travels far. But please don't get distracted.,情報が随分遠くまで伝わっているのね。でも、気を散らさないで。,소문이 정말 멀리까지 퍼졌네. 하지만 주의를 흩트리지 마세요.
阿斯莫德，你太小心了。城主，说说你们城邦的事。,阿斯莫德，你太小心了。城主，說說你們城邦的事。,"Asmodeus, you're too cautious. Lord, tell us about your city-state.",アスモード、あなたは慎重すぎるよ。城主、あなたの城邦のことを話してよ。,"아스모데우스, 너 너무 조심하는 것 아니니. 성주님, 당신 도시 국가 이야기를 해보세요."
我们城邦如今三族和谐，但草木枯萎让我们担忧。,我們城邦如今三族和諧，但草木枯萎讓我們擔憂。,"Our city-state now enjoys harmony among the three races, but the flora withering worries us.",私たちの城邦では今、三つの種族が調和しているけど、草木の枯死が心配なんだ。,"우리 도시 국가는 지금 세 종족이 조화를 이루고 있지만, 초목이 시드는 일이 우리를 걱정하게 만들었어요."
三族和谐？人类、精灵和兽人？,三族和諧？人類、精靈和獸人？,"Harmony among three races? Humans, Elves, and Orcs?",三種族の調和？人間と精霊とオーク？,"세 종족의 조화? 인간, 엘프, 오크?"
对，就像你们森林里一样。,對，就像你們森林裡一樣。,"Yes, much like in your forest here.",そう、あなた方の森と同じように。,"네, 마치 당신들 숲 속처럼요."
有趣。但森林最近也不太平。,有趣。但森林最近也不太平。,Interesting. But the forest hasn't been peaceful lately either.,面白いね。でも、森も最近は平穏じゃないんだ。,흥미롭군. 하지만 숲도 요즘 평안하지 않아.
吉蒙里，别多说。先到营地再说。,吉蒙里，別多說。先到營地再說。,"Gremory, no need to say more. Let's reach the camp first.",ギモンリ、余計なことは言わないで。まずキャンプに着いてから。,"기몬리, 말을 줄여. 먼저 야영지에 도착하자."
快到了，前面就是警戒线。,快到了，前面就是警戒線。,We're almost there. That's the sentry line ahead.,もうすぐだよ、前が警戒ラインだ。,"거의 다 왔어, 앞쪽이 바로 경계선이야."
好了，通过这里就安全了。但盘问还没结束。,好了，通過這裡就安全了。但盤問還沒結束。,"Alright. Passing here means safety, but the questioning isn't over.",よし、ここを越えれば安全だ。でも尋問はまだ終わってない。,"좋아, 여기를 통과하면 안전해. 하지만 심문은 아직 끝나지 않았어."
我们愿意接受任何检查。,我們願意接受任何檢查。,We are willing to accept any inspection.,どんな検査でも受けます。,우리는 어떤 검사든 받을 준비가 되어 있습니다.
长老会决定下一步。,長老會決定下一步。,The elders will decide the next steps.,長老会が次の判断をするわ。,장로회에서 다음 단계를 결정할 거야.
薇薇安，去通知长老我们来了。,薇薇安，去通知長老我們來了。,"Vivian, inform the elders of our arrival.",ビビアン、長老に私たちが来たことを知らせて。,"비비안, 장로님께 우리가 왔음을 알려줘."
是，我马上用月光信号。,是，我馬上用月光信號。,Yes. I'll use the moonlight signal immediately.,はい、すぐに月光信号を送ります。,"네, 제가 지금 바로 달빛 신호를 보내겠습니다."
薇薇安双手轻抬，一道柔和的月光从她手中升起，迅速消失在森林深处，这是精灵族特有的传信方式。,薇薇安雙手輕抬，一道柔和的月光從她手中升起，迅速消失在森林深處，這是精靈族特有的傳信方式。,Vivian gently raised her hands. A soft beam of moonlight rose from her palms and swiftly vanished deep into the forest—a unique Elven method of communication.,ビビアンは両手を軽く上げ、柔らかな月明かりが彼女の手から立ち上り、森の奥へと消えていった。これは精霊族特有の伝達方法だ。,"비비안은 두 손을 가볍게 들어 올리자, 그녀의 손에서 부드러운 달빛이 떠올라 숲 깊은 곳으로 재빨리 사라졌다. 이것은 엘프족 특유의 전신 방식이었다."
城主，跟紧我。别掉队。,城主，跟緊我。別掉隊。,"""Lord, stay close to me. Don't fall behind.""",城主、私にしっかりついてきて。はぐれるなよ。,"성주님, 저를 따라오세요. 떨어지지 마세요."
我们会的。,我們會的。,"""We will.""",はい、分かりました。,그렇게 하겠습니다.
希望你们的到来能带来好消息。,希望你們的到來能帶來好消息。,"""We hope your arrival brings good news.""",あなた方の訪問が良い知らせをもたらすことを願うよ。,당신들의 방문이 좋은 소식을 가져오길 바랍니다.
但愿如此。大地似乎对你们没有恶意。,但願如此。大地似乎對你們沒有惡意。,"""We hope so too. The earth seems to bear you no ill will.""",そう願いたいね。大地はあなたたちに悪意を抱いていないようだ。,그러길 바랍니다. 대지가 당신들에게 악의가 없는 것 같군요.
感谢信任,感謝信任。,"""Thank you for the trust.""",信頼してくれてありがとう。,신뢰해 주셔서 감사합니다.
信号已发送，长老会回应了。,信號已發送，長老會回應了。,"""The signal has been sent. The elder council has responded.""",信号は送信済み、長老会からの応答あり。,"신호가 전송되었습니다, 장로회에서 응답이 왔어요."
好。我们直接去集会厅,好。我們直接去集會廳。,"""Good. We'll go directly to the assembly hall.""",よし。直接集会場へ向かう。,좋아. 우리 바로 회의장으로 가자.
我会安排小队休息。,我會安排小隊休息。,"""I will arrange for the squad to rest.""",チームの休息を手配するわ。,제가 소대 휴식을 주선하겠습니다.
谢谢你们。,謝謝你們。,"""Thank you all.""",ありがとうございます。,감사합니다.
别谢太早，长老可能还有问题。,別謝太早，長老可能還有問題。,"""Don't thank us too soon. The elders may have more questions.""",まだ感謝するのは早いよ、長老はまだ質問があるかもしれないから。,"너무 일찍 감사하지 마세요, 장로님께서 아직 질문이 더 있으실지도 몰라요."
姐姐，别吓唬他们了。,姐姐，別嚇唬他們了。,"""Sister, stop frightening them.""",姉様、彼らを脅かさないでよ。,"언니, 그들을 놀라게 하지 마요."
哈哈，开个玩笑。走吧。,哈哈，開個玩笑。走吧。,"""Haha, just joking. Let's go.""",はは、冗談だよ。行こう。,"하하, 농담이야. 가자."
你和你的小队被引导至精灵之森中心区域稍作休整，一位名为普奥娜的精灵女子前来接待你们，她身旁跟着一位充满活力的精灵骑士,你和你的小隊被引導至精靈之森中心區域稍作休整，一位名為普奧娜的精靈女子前來接待你們，她身旁跟著一位充滿活力的精靈騎士。,"You and your squad were guided to a rest area in the heart of the Elvenwood. An Elven woman named Puona came to receive you, accompanied by a lively Elven knight.",あなたとチームは精霊の森の中心部へと導かれ、少し休憩することになった。プオナという名の精霊女性が出迎え、彼女の傍らには活気に満ちた精霊騎士が一人ついていた。,"당신과 당신의 소대는 엘프의 숲 중심 지역으로 안내되어 잠시 휴식을 취하게 되었고, 푸오나라는 이름의 엘프 여성이 여러분을 맞이하러 왔으며, 그녀 곁에는 활기찬 엘프 기사가 하나 따라왔다."
欢迎来到精灵之森的中心区域，我是普奥娜，负责安排各位在此处的起居。,歡迎來到精靈之森的中心區域，我是普奧娜，負責安排各位在此處的起居。,"""Welcome to the heart of the Elvenwood. I am Puona, responsible for arranging your accommodations here.""",精霊の森の中心域へようこそ。私はプオナと申します。こちらでの皆様の滞在を手配いたします。,"엘프의 숲 중심 지역에 오신 것을 환영합니다. 저는 푸오나로, 여러분의 이곳 생활을 책임지고 있습니다."
我是克图格亚，森林护卫队的骑士！接下来由我带领各位参观这片圣地！,我是克圖格亞，森林護衛隊的騎士！接下來由我帶領各位參觀這片聖地！,"""And I am Cthugha, a knight of the Forest Guard! I will be your guide through this sacred land!""",私はクトコア、森の護衛隊の騎士です！これから私がこの聖域をご案内いたします！,"저는 쿠토코아, 숲 호위대의 기사입니다! 앞으로 제가 여러분을 이 성지로 안내하겠습니다!"
感谢二位的盛情。这里的景象令人惊叹，精灵与兽人竟能如此和谐地共处。,感謝二位的盛情。這裡的景象令人驚歎，精靈與獸人竟能如此和諧地共處。,"""Thank you both for your warm welcome. The sight here is breathtaking. Elves and Orcs coexist in such harmony.""",お二人の厚意に感謝します。ここの光景には驚かされます。精霊とオークがこんなに調和して共存しているのですね。,"두 분의 성의에 감사드립니다. 이곳의 풍경은 정말 놀랍습니다, 엘프와 오크가 이렇게나 조화롭게 공존하다니."
是的，近年来我们逐步开放森林的居住权，许多兽人同胞选择在此定居，大家相处得颇为融洽。,是的，近年來我們逐步開放森林的居住權，許多獸人同胞選擇在此定居，大家相處得頗為融洽。,"""Yes. In recent years, we have gradually opened the forest's residency rights. Many of our Orc brethren have chosen to settle here. Everyone gets along quite well.""",はい、近年、森の居住権を段階的に開放し、多くのオークの同胞がここに住むことを選びました。皆、とても仲良くやっています。,"네, 최근 몇 년간 우리는 점차 숲의 거주권을 개방하여 많은 오크 동포들이 이곳에 정착하기로 선택했고, 모두가 꽤 좋은 관계를 유지하고 있습니다."
请看那边！那棵参天巨木便是我们的世界树，是森林的生命之源。它周围环绕的是混合林带与魔法林地。,請看那邊！那棵參天巨木便是我們的世界樹，是森林的生命之源。它周圍環繞的是混合林帶與魔法林地。,"""Look over there! That towering giant tree is our World Tree, the source of the forest's life. Surrounding it are the mixed woodland and magical groves.""",あちらをご覧ください！あのそびえ立つ巨木が私たちの世界樹です。森の生命の源です。その周りを取り囲むのは混合林帯と魔法林地です。,"저쪽을 보세요! 그 우람한 거목이 바로 우리의 세계수입니다, 숲의 생명의 근원이죠. 그 주위를 둘러싼 것은 혼합림대와 마법림지입니다."
我注意到许多精灵与兽人都在忙碌，这片森林充满了生机与繁荣的气息。,我注意到許多精靈與獸人都在忙碌，這片森林充滿了生機與繁榮的氣息。,"""I notice many Elves and Orcs are busy. This forest is full of vitality and prosperity.""",多くの精霊とオークが忙しく動いているのに気づきました。この森は生気と繁栄の息吹に満ちていますね。,"많은 엘프와 오크들이 모두 바쁘게 움직이고 있는 걸 봤어요, 이 숲은 생기와 번영의 기운으로 가득하네요."
没错！我们精灵一族天性热爱和平，但与兽人同胞通力合作之后，森林的防御与生机都变得更加强大了！,沒錯！我們精靈一族天性熱愛和平，但與獸人同胞通力合作之後，森林的防禦與生機都變得更加強大了！,"""Exactly! We Elves have a nature-loving and peace-loving spirit. But after working together with our Orc brethren, the forest's defenses and vitality have grown even stronger!""",その通りです！私たち精霊族は生まれつき平和を愛しますが、オークの同胞と力を合わせてからは、森の防御も生命力もさらに強まりました！,"맞아요! 우리 엘프족은 본래 평화를 사랑하지만, 오크 동포들과 힘을 합친 후 숲의 방어와 생기가 모두 훨씬 더 강력해졌습니다!"
克图格亚，注意你的仪态，不要过于激动。城主，请您放心，此地十分安全。,克圖格亞，注意你的儀態，不要過於激動。城主，請您放心，此地十分安全。,"""Cthugha, mind your decorum. Don't get too excited. Lord, please rest assured. This place is very safe.""",クトコア、あなたの振る舞いに注意、興奮しすぎないで。城主、どうぞご安心ください。ここは非常に安全です。,"쿠토코아, 너의 태도를 조심해, 너무 흥분하지 마. 성주님, 안심하세요, 이곳은 매우 안전합니다."
哦，抱歉。我有些过于兴奋了。请随我来，我为各位介绍几处值得一看的景致。,哦，抱歉。我有些過於興奮了。請隨我來，我為各位介紹幾處值得一看的景致。,"""Oh, apologies. I got a bit too excited. Please follow me. I'll show you some sights worth seeing.""",あ、すみません。つい興奮してしまいました。どうぞこちらへ、いくつか見どころをご紹介します。,"아, 죄송합니다. 제가 너무 흥분했네요. 저를 따라오세요, 제가 여러분께 볼만한 경치 몇 군데를 소개해 드릴게요."
我很乐意了解。久闻精灵之森蕴藏着古老的魔法。,我很樂意了解。久聞精靈之森蘊藏著古老的魔法。,"""I would be delighted to learn more. I've long heard the Elvenwood holds ancient magic.""",ぜひ知りたいです。精霊の森には古の魔法が秘められていると前々から聞いていました。,기꺼이 알고 싶습니다. 엘프의 숲에 고대 마법이 깃들어 있다는 말을 오래전부터 들었습니다.
的确如此！例如那片光影泉，能在月夜下倒映出奇异的光芒。不过有一次我误将其光芒当作了黑暗生物的气息，差点就发动了净化术式！,的確如此！例如那片光影泉，能在月夜下倒映出奇異的光芒。不過有一次我誤將其光芒當作了黑暗生物的氣息，差點就發動了淨化術式！,"""Indeed! For example, that Lightshadow Spring over there can reflect strange lights on moonlit nights. Though once, I mistook its glow for the aura of a dark creature and nearly activated a purification spell!""",確かにそうです！例えばあの光陰の泉は、月夜に奇妙な光を映し出します。でも一度、私はその光を闇の生物の気配と間違えて、浄化の術式を発動するところでした！,정말 그래요! 예를 들어 저 빛과 그림자의 샘은 달밤에 기이한 빛을 비출 수 있습니다. 하지만 한번은 제가 그 빛을 어둠 생물의 기운으로 오인하여 정화 술식을 발동할 뻔했어요!
克图格亚，那是一次小小的误会，不必再次提及了。城主，请您见谅，她只是责任心格外强烈。,克圖格亞，那是一次小小的誤會，不必再次提及了。城主，請您見諒，她只是責任心格外強烈。,"""Cthugha, that was a minor misunderstanding. No need to bring it up again. Lord, please excuse her. She just has an exceptionally strong sense of duty.""",クトコア、それは小さな誤解だったわ、もう取り上げなくていいの。城主、お許しください。彼女はただ責任感が人一倍強いだけです。,"쿠토코아, 그건 작은 오해였어, 다시 꺼내지 마. 성주님, 양해 부탁드립니다, 그녀는 그저 책임감이 유난히 강할 뿐입니다."
我能理解。在我的城邦中，也不乏如此热心尽责的伙伴。,我能理解。在我的城邦中，也不乏如此熱心盡責的夥伴。,"""I understand. In my city-state, there are also many equally enthusiastic and responsible companions.""",理解できます。私の城邦にも、そんなに熱心で責任感のある仲間がいますから。,이해할 수 있어요. 제 도시 국가에도 그렇게 열정적이고 책임감 있는 동료들이 많습니다.
真的吗？那太好了！我相信守护森林是生活在此的每一位成员的责任。,真的嗎？那太好了！我相信守護森林是生活在此的每一位成員的責任。,"""Really? That's wonderful! I believe protecting the forest is the responsibility of every member living here.""",本当ですか？それは良かった！私は森を守ることが、ここに住むすべての者の責任だと思っています。,정말요? 그거 정말 좋네요! 저는 숲을 지키는 것이 이곳에 사는 모든 구성원의 책임이라고 믿습니다.
克图格亚，不如带城主去参观一下精灵集市吧。,克圖格亞，不如帶城主去參觀一下精靈集市吧。,"""Cthugha, why not take the Lord to visit the Elven marketplace?""",クトコア、城主を精霊の市場に案内してはどうかしら。,"쿠토코아, 성주님을 엘프 시장에 데리고 가 보는 게 어때?"
好主意！集市上有很多兽人同胞出售他们亲手制作的工艺品，非常精美。,好主意！集市上有很多獸人同胞出售他們親手製作的工藝品，非常精美。,"""Excellent idea! At the marketplace, many of our Orc brethren sell exquisite handmade crafts.""",良い案です！市場では多くのオークの同胞が手作りの工芸品を売っていて、とても美しいですよ。,"좋은 생각이에요! 시장에는 많은 오크 동포들이 직접 만든 공예품을 팔고 있는데, 아주 정교합니다."
兽人族群也在此地安居？这真是令人欣慰的景象。,獸人族群也在此地安居？這真是令人欣慰的景象。,"""The Orc communities have settled here too? That is truly a heartwarming sight.""",オークの集団もここに定住しているのですか？これは心温まる光景です。,오크족도 이곳에 평화롭게 정착했나요? 이건 정말 위안이 되는 풍경이네요.
是的！他们非常擅长培育植物，就像贝缇缇娜那样，她可是照看花草的能手。,是的！他們非常擅長培育植物，就像貝緹娜那樣，她可是照看花草的能手。,"""Yes! They are very skilled at cultivating plants. Like Bettina, for instance—she's a master at caring for flowers and herbs.""",はい！彼らは植物を育てるのがとても上手です。ベティナみたいにね、彼女は草花の世話の名人ですから。,"네! 그들은 식물 재배에 아주 능숙해요, 마치 베티나처럼요, 그녀는 정말 식물을 돌보는 능수죠."
贝缇缇娜虽为兽人，但性情十分温柔，极其爱护草木。,貝緹娜雖為獸人，但性情十分溫柔，極其愛護草木。,"""Although Bettina is an Orc, her nature is very gentle, and she cares deeply for plants.""",ベティナはオークですが、とても穏やかな性格で、草木を大切にします。,"베티나는 비록 오크족이지만, 성격이 매우 부드럽고 초목을 지극히 아낍니다."
我似乎听说过她的名字。或许眼前遇到的草木枯萎问题，也能得到她的帮助。,我似乎聽說過她的名字。或許眼前遇到的草木枯萎問題，也能得到她的幫助。,"""I believe I've heard her name before. Perhaps she could also help with the current issue of flora withering.""",彼女の名前を聞いたことがあるようです。今、直面している草木の枯死の問題も、彼女が手助けしてくれるかもしれません。,저는 그녀의 이름을 들어본 적이 있는 것 같아요. 아마도 지금 마주한 초목 시들음 문제도 그녀의 도움을 받을 수 있을지 모르겠네요.
对！贝缇缇娜肯定能帮上忙！……不过在那之前，请允许我再次确认各位周围绝对安全。,對！貝緹娜肯定能幫上忙！……不過在那之前，請允許我再次確認各位周圍絕對安全。,"""Right! Bettina would definitely be able to help! ...But before that, please allow me to confirm once more that your surroundings are absolutely safe.""",そうです！ベティナならきっと役に立ちます！……でもその前に、皆様の周囲が絶対に安全であることをもう一度確認させてください。,"맞아요! 베티나가 분명 도움을 줄 수 있을 거예요! …하지만 그 전에, 제가 다시 한번 여러분 주변의 절대적인 안전을 확인하는 것을 허락해 주세요."
克图格亚，城主是我们的贵客，并非需要盘查的对象。,克圖格亞，城主是我們的貴客，並非需要盤查的對象。,"""Cthugha, the Lord is our honored guest, not someone to be interrogated.""",クトコア、城主は私たちの賓客です。取り調べの対象ではありません。,"쿠토코아, 성주님은 우리의 귀빈이지, 심문의 대상이 아닙니다."
